{
  "schemaVersion": 1,
  "configVersion": "1.0.0-design",
  "maxRouteSteps": 3,
  "priorityOrder": "ascending",
  "notes": "Four one-way PDF routes have bundled engines and execute in Debug and Release. Definitions outside product-scope.json remain disabled. Device qualification and fidelity are not implied.",
  "routes": [
    {
      "id": "jpeg-pdf",
      "from": [
        "jpeg"
      ],
      "to": "pdf",
      "operation": "images_to_pdf",
      "pathMode": "direct",
      "intent": "layout_preserved",
      "fidelityTier": "extreme",
      "engineIds": [
        "image",
        "pdf"
      ],
      "priority": 10,
      "status": "experimental",
      "phase": 1,
      "steps": [
        {
          "stepId": "jpeg-pdf-1",
          "engineIds": [
            "image",
            "pdf"
          ],
          "inputFormatIds": [
            "jpeg"
          ],
          "outputFormatId": "pdf",
          "operation": "images_to_pdf",
          "executorEngineId": "image"
        }
      ],
      "fallbackRouteIds": [],
      "requiresUserApproval": false,
      "allowedDegradations": [],
      "inputConstraints": {
        "minInputs": 1,
        "maxInputs": 1,
        "protectedInputs": "block"
      },
      "optionsProfileId": "images_pdf",
      "validationProfileId": "image_pdf"
    },
    {
      "id": "png-pdf",
      "from": [
        "png"
      ],
      "to": "pdf",
      "operation": "images_to_pdf",
      "pathMode": "direct",
      "intent": "layout_preserved",
      "fidelityTier": "extreme",
      "engineIds": [
        "image",
        "pdf"
      ],
      "priority": 10,
      "status": "experimental",
      "phase": 1,
      "steps": [
        {
          "stepId": "png-pdf-1",
          "engineIds": [
            "image",
            "pdf"
          ],
          "inputFormatIds": [
            "png"
          ],
          "outputFormatId": "pdf",
          "operation": "images_to_pdf",
          "executorEngineId": "image"
        }
      ],
      "fallbackRouteIds": [],
      "requiresUserApproval": false,
      "allowedDegradations": [],
      "inputConstraints": {
        "minInputs": 1,
        "maxInputs": 1,
        "protectedInputs": "block"
      },
      "optionsProfileId": "images_pdf",
      "validationProfileId": "image_pdf"
    },
    {
      "id": "mixed-images-pdf",
      "from": [
        "jpeg",
        "png"
      ],
      "to": "pdf",
      "operation": "images_to_pdf",
      "pathMode": "direct",
      "intent": "layout_preserved",
      "fidelityTier": "extreme",
      "engineIds": [
        "image",
        "pdf"
      ],
      "priority": 10,
      "status": "planned",
      "phase": 1,
      "steps": [
        {
          "stepId": "mixed-images-pdf-1",
          "engineIds": [
            "image",
            "pdf"
          ],
          "inputFormatIds": [
            "jpeg",
            "png"
          ],
          "outputFormatId": "pdf",
          "operation": "images_to_pdf",
          "executorEngineId": "image"
        }
      ],
      "fallbackRouteIds": [],
      "requiresUserApproval": false,
      "allowedDegradations": [],
      "inputConstraints": {
        "minInputs": 1,
        "maxInputs": 100,
        "protectedInputs": "block"
      },
      "optionsProfileId": "images_pdf",
      "validationProfileId": "image_pdf"
    },
    {
      "id": "pdf-png",
      "from": [
        "pdf"
      ],
      "to": "png",
      "operation": "convert",
      "pathMode": "direct",
      "intent": "layout_preserved",
      "fidelityTier": "standard",
      "engineIds": [
        "pdf",
        "image"
      ],
      "priority": 10,
      "status": "planned",
      "phase": 2,
      "steps": [
        {
          "stepId": "pdf-png-1",
          "engineIds": [
            "pdf",
            "image"
          ],
          "inputFormatIds": [
            "pdf"
          ],
          "outputFormatId": "png",
          "operation": "convert",
          "executorEngineId": "pdf"
        }
      ],
      "fallbackRouteIds": [],
      "requiresUserApproval": false,
      "allowedDegradations": [],
      "inputConstraints": {
        "minInputs": 1,
        "maxInputs": 1,
        "protectedInputs": "block"
      },
      "optionsProfileId": "pdf_render",
      "validationProfileId": "pdf_image"
    },
    {
      "id": "pdf-jpeg",
      "from": [
        "pdf"
      ],
      "to": "jpeg",
      "operation": "convert",
      "pathMode": "direct",
      "intent": "layout_preserved",
      "fidelityTier": "standard",
      "engineIds": [
        "pdf",
        "image"
      ],
      "priority": 10,
      "status": "planned",
      "phase": 2,
      "steps": [
        {
          "stepId": "pdf-jpeg-1",
          "engineIds": [
            "pdf",
            "image"
          ],
          "inputFormatIds": [
            "pdf"
          ],
          "outputFormatId": "jpeg",
          "operation": "convert",
          "executorEngineId": "pdf"
        }
      ],
      "fallbackRouteIds": [],
      "requiresUserApproval": false,
      "allowedDegradations": [],
      "inputConstraints": {
        "minInputs": 1,
        "maxInputs": 1,
        "protectedInputs": "block"
      },
      "optionsProfileId": "pdf_render",
      "validationProfileId": "pdf_image"
    },
    {
      "id": "pdf_split",
      "from": [
        "pdf"
      ],
      "to": "pdf",
      "operation": "pdf_split",
      "pathMode": "direct",
      "intent": "layout_preserved",
      "fidelityTier": "extreme",
      "engineIds": [
        "pdf"
      ],
      "priority": 10,
      "status": "planned",
      "phase": 2,
      "steps": [
        {
          "stepId": "pdf_split-1",
          "engineIds": [
            "pdf"
          ],
          "inputFormatIds": [
            "pdf"
          ],
          "outputFormatId": "pdf",
          "operation": "pdf_split",
          "executorEngineId": "pdf"
        }
      ],
      "fallbackRouteIds": [],
      "requiresUserApproval": false,
      "allowedDegradations": [],
      "inputConstraints": {
        "minInputs": 1,
        "maxInputs": 1,
        "protectedInputs": "block"
      },
      "optionsProfileId": "pdf_pages",
      "validationProfileId": "pdf_pages"
    },
    {
      "id": "pdf_merge",
      "from": [
        "pdf"
      ],
      "to": "pdf",
      "operation": "pdf_merge",
      "pathMode": "direct",
      "intent": "layout_preserved",
      "fidelityTier": "extreme",
      "engineIds": [
        "pdf"
      ],
      "priority": 10,
      "status": "planned",
      "phase": 2,
      "steps": [
        {
          "stepId": "pdf_merge-1",
          "engineIds": [
            "pdf"
          ],
          "inputFormatIds": [
            "pdf"
          ],
          "outputFormatId": "pdf",
          "operation": "pdf_merge",
          "executorEngineId": "pdf"
        }
      ],
      "fallbackRouteIds": [],
      "requiresUserApproval": false,
      "allowedDegradations": [],
      "inputConstraints": {
        "minInputs": 1,
        "maxInputs": 100,
        "protectedInputs": "block"
      },
      "optionsProfileId": "pdf_pages",
      "validationProfileId": "pdf_pages"
    },
    {
      "id": "jpeg-png",
      "from": [
        "jpeg"
      ],
      "to": "png",
      "operation": "convert",
      "pathMode": "direct",
      "intent": "layout_preserved",
      "fidelityTier": "standard",
      "engineIds": [
        "image"
      ],
      "priority": 10,
      "status": "planned",
      "phase": 2,
      "steps": [
        {
          "stepId": "jpeg-png-1",
          "engineIds": [
            "image"
          ],
          "inputFormatIds": [
            "jpeg"
          ],
          "outputFormatId": "png",
          "operation": "convert",
          "executorEngineId": "image"
        }
      ],
      "fallbackRouteIds": [],
      "requiresUserApproval": false,
      "allowedDegradations": [],
      "inputConstraints": {
        "minInputs": 1,
        "maxInputs": 1,
        "protectedInputs": "block"
      },
      "optionsProfileId": "image_convert",
      "validationProfileId": "image"
    },
    {
      "id": "jpeg-webp",
      "from": [
        "jpeg"
      ],
      "to": "webp",
      "operation": "convert",
      "pathMode": "direct",
      "intent": "layout_preserved",
      "fidelityTier": "compatible",
      "engineIds": [
        "image"
      ],
      "priority": 10,
      "status": "planned",
      "phase": 2,
      "steps": [
        {
          "stepId": "jpeg-webp-1",
          "engineIds": [
            "image"
          ],
          "inputFormatIds": [
            "jpeg"
          ],
          "outputFormatId": "webp",
          "operation": "convert",
          "executorEngineId": "image"
        }
      ],
      "fallbackRouteIds": [],
      "requiresUserApproval": false,
      "allowedDegradations": [],
      "inputConstraints": {
        "minInputs": 1,
        "maxInputs": 1,
        "protectedInputs": "block"
      },
      "optionsProfileId": "image_convert",
      "validationProfileId": "image"
    },
    {
      "id": "png-jpeg",
      "from": [
        "png"
      ],
      "to": "jpeg",
      "operation": "convert",
      "pathMode": "direct",
      "intent": "layout_preserved",
      "fidelityTier": "compatible",
      "engineIds": [
        "image"
      ],
      "priority": 10,
      "status": "planned",
      "phase": 2,
      "steps": [
        {
          "stepId": "png-jpeg-1",
          "engineIds": [
            "image"
          ],
          "inputFormatIds": [
            "png"